{
  "homeHighlights": [
    {
      "meta": "2026 · Research",
      "title": "Clinical Modifiers of Salt Sensitivity · Hypertension",
      "description": "First-author metaregression and risk translation study showing that age and baseline blood pressure strongly modify salt sensitivity and the expected cardiovascular benefit of sodium reduction.",
      "href": "https://doi.org/10.1161/HYPERTENSIONAHA.126.27410"
    },
    {
      "meta": "2026 · Award",
      "title": "Paul Dudley White International Scholar Award",
      "description": "American Heart Association EPI|Lifestyle Scientific Sessions.",
      "href": "",
      "links": [
        {
          "label": "NYCU School of Medicine coverage",
          "href": "https://med.nycu.edu.tw/med/ch/app/news/view?module=headnews&id=36202&serno=6d0b3c22-9a21-4d44-9394-94d0df7cc38a"
        }
      ]
    },
    {
      "meta": "Media",
      "title": "AHA Newsroom Feature",
      "description": "Research on abdominal adiposity, inflammation, and heart failure risk featured by the American Heart Association and major health media.",
      "href": "https://newsroom.heart.org/news/extra-belly-weight-not-bmi-was-a-stronger-predictor-of-heart-failure-risk-inflammation"
    }
  ],
  "blogTagOptions": [
    {
      "slug": "epidemiology-health-media-literacy",
      "label": "流行病學與健康媒體識讀"
    },
    {
      "slug": "health-prevention",
      "label": "健康與預防"
    },
    {
      "slug": "research-methods",
      "label": "研究方法"
    },
    {
      "slug": "research-notes",
      "label": "研究筆記"
    },
    {
      "slug": "academic-essay",
      "label": "學術隨筆"
    },
    {
      "slug": "risk",
      "label": "風險"
    },
    {
      "slug": "observational-studies",
      "label": "觀察性研究"
    },
    {
      "slug": "case-control-study",
      "label": "case-control study"
    }
  ],
  "blogSeriesOptions": [
    {
      "slug": "evidence",
      "label": "讀懂健康研究的證據思維"
    },
    {
      "slug": "risk",
      "label": "風險數字怎麼判讀"
    },
    {
      "slug": "epi-lec",
      "label": "流行病學方法教學"
    }
  ],
  "publications": [
    {
      "year": "2026",
      "category": "Journal Publications",
      "title": "Recent Advance in Nocturnal Hypertension: Pathophysiology, Emerging Diagnostics, and Precision Management in Asian Populations",
      "authors": "Szu-Han Chen, Hao-Min Cheng.",
      "venue": "JACC: Asia. Accepted.",
      "summary": "Invited State-of-the-Art Review on nocturnal hypertension in Asian populations, covering Asian-relevant drivers such as salt sensitivity, obstructive sleep apnea, and autonomic dysfunction, emerging nighttime blood pressure diagnostics including automated home blood pressure monitoring, and precision management strategies.",
      "tags": [
        {
          "slug": "review",
          "label": "Review",
          "group": "Study Design"
        },
        {
          "slug": "hypertension",
          "label": "Hypertension",
          "group": "Topics"
        }
      ],
      "firstAuthor": true,
      "correspondingAuthor": false,
      "featured": false
    },
    {
      "year": "2026",
      "category": "Journal Publications",
      "title": "Central Blood Pressure, Calibration, and Discordance: Refining Hypertensive Cardiac Risk Assessment",
      "authors": "Szu-Han Chen, Hao-Min Cheng.",
      "venue": "Journal of the American Heart Association. 2026;15(16):e052726.",
      "summary": "Editorial commentary on findings from the International 24-Hour Aortic Blood Pressure Consortium, highlighting how central blood pressure calibration and central–brachial discordance can refine hypertensive cardiac risk assessment.",
      "doi": "https://doi.org/10.1161/JAHA.126.052726",
      "tags": [
        {
          "slug": "methods",
          "label": "Methods",
          "group": "Study Design"
        },
        {
          "slug": "hypertension",
          "label": "Hypertension",
          "group": "Topics"
        }
      ],
      "firstAuthor": true,
      "correspondingAuthor": false,
      "featured": false
    },
    {
      "year": "2026",
      "category": "Journal Publications",
      "title": "Central Adiposity, Systemic Inflammation, and Incident Heart Failure: A Causal Mediation Analysis From the Jackson Heart Study",
      "authors": "Szu-Han Chen, Yu-Hsuan Lee, Shao-Yuan Chuang, Marat Fudim, Chun-Wei Lee, Chi-Jung Huang, Hao-Min Cheng.",
      "venue": "Journal of the American Heart Association. 2026;15(15):e049997.",
      "summary": "In 1,998 Jackson Heart Study participants, central adiposity and systemic inflammation—but not BMI—were associated with incident heart failure; hs-CRP mediated 26.5% of the waist circumference association and 32.4% of the waist-to-height ratio association.",
      "doi": "https://doi.org/10.1161/JAHA.126.049997",
      "tags": [
        {
          "slug": "cohort-study",
          "label": "Cohort Study",
          "group": "Study Design"
        },
        {
          "slug": "heart-failure",
          "label": "Heart Failure",
          "group": "Topics"
        },
        {
          "slug": "metabolic-health",
          "label": "Metabolic Health",
          "group": "Topics"
        },
        {
          "slug": "obesity",
          "label": "Obesity",
          "group": "Topics"
        }
      ],
      "firstAuthor": true,
      "correspondingAuthor": false,
      "featured": false
    },
    {
      "year": "2026",
      "category": "Journal Publications",
      "title": "Clinical Modifiers of Salt Sensitivity: A Meta-Regression and Risk Translation Study",
      "authors": "Szu-Han Chen, Chih-Yu Yeh, Yu-Pan Chiang-Lin, Chi-Jung Huang, Shao-Yuan Chuang, Chih-Cheng Wu, Wen-Harn Pan, Yuan Ma, Liming Liang, Hao-Min Cheng.",
      "venue": "Hypertension. 2026;83(9):e27410.",
      "summary": "Across 160 studies with 16,443 participants, age and baseline systolic blood pressure were the strongest modifiers of salt sensitivity, producing a 15-fold gradient in the estimated number needed to restrict sodium intake to prevent one cardiovascular event.",
      "doi": "https://doi.org/10.1161/HYPERTENSIONAHA.126.27410",
      "tags": [
        {
          "slug": "meta-analysis",
          "label": "Meta-analysis",
          "group": "Study Design"
        },
        {
          "slug": "hypertension",
          "label": "Hypertension",
          "group": "Topics"
        },
        {
          "slug": "nutrition",
          "label": "Nutrition",
          "group": "Topics"
        }
      ],
      "firstAuthor": true,
      "correspondingAuthor": false,
      "featured": true
    },
    {
      "year": "2026",
      "category": "Journal Publications",
      "title": "Dietary Patterns and Risk of Cardiovascular Disease and All-cause Mortality in Adults with Untreated or Uncontrolled Hypertension",
      "authors": "Szu-Han Chen, Binkai Liu, Hao-Min Cheng, Liming Liang, Frank B. Hu",
      "venue": "The Journal of Nutrition. 2026;156(8):101659",
      "summary": "Higher diet quality, especially DASH and reversed EDIP scores, is associated with lower risks of CVD and death in adults with uncontrolled or untreated hypertension.",
      "doi": "https://doi.org/10.1016/j.tjnut.2026.101659",
      "tags": [
        {
          "slug": "cohort-study",
          "label": "Cohort Study",
          "group": "Study Design"
        },
        {
          "slug": "nutrition",
          "label": "Nutrition",
          "group": "Topics"
        },
        {
          "slug": "hypertension",
          "label": "Hypertension",
          "group": "Topics"
        }
      ],
      "firstAuthor": true,
      "correspondingAuthor": false,
      "featured": false
    },
    {
      "year": "2026",
      "title": "Abstract MPWE48: Metabolomics-Based Reclassification of Ultra-Processed Foods and Risk of Cardiometabolic Outcomes",
      "category": "Published Conference Abstracts",
      "authors": "Szu-Han Chen, Mengxi Du, Binkai Liu, Danielle E. Haslam, Liming Liang, Frank B. Hu",
      "venue": "Circulation. 2026, 153(Suppl_1):AMPWE48–AMPWE",
      "firstAuthor": true,
      "correspondingAuthor": false,
      "doi": "https://doi.org/10.1161/cir.153.suppl_1.MPWE48",
      "tags": [
        {
          "slug": "cohort-study",
          "label": "Cohort Study",
          "group": "Study Design"
        },
        {
          "slug": "nutrition",
          "label": "Nutrition",
          "group": "Topics"
        },
        {
          "slug": "metabolic-health",
          "label": "Metabolic Health",
          "group": "Topics"
        }
      ],
      "featured": false
    },
    {
      "year": "2026",
      "title": "Abstract TU169: Healthy Dietary Patterns Are Associated With Lower Cardiovascular Risk and All-Cause Mortality Among Hypertensive Adults",
      "category": "Published Conference Abstracts",
      "authors": "Szu-Han Chen, Binkai Liu, Hao-Min Cheng, Liming Liang, Frank B. Hu",
      "venue": "Circulation. 2026, 153(Suppl_1):ATU169–ATU",
      "firstAuthor": true,
      "correspondingAuthor": false,
      "doi": "https://doi.org/10.1161/cir.153.suppl_1.TU169",
      "tags": [
        {
          "slug": "cohort-study",
          "label": "Cohort Study",
          "group": "Study Design"
        },
        {
          "slug": "nutrition",
          "label": "Nutrition",
          "group": "Topics"
        },
        {
          "slug": "hypertension",
          "label": "Hypertension",
          "group": "Topics"
        }
      ],
      "featured": false
    },
    {
      "year": "2026",
      "title": "Abstract MPTH72: Systemic Inflammation Mediates the Association Between Central Obesity and Incident Heart Failure",
      "category": "Published Conference Abstracts",
      "authors": "Szu-Han Chen, Yu-Hsuan Lee, Shao-Yuan Chuang, Marat Fudim, Chun-Wei Lee, Chi-Jung Huang, Hao-Min Cheng",
      "venue": "Circulation. 2026, 153(Suppl_1):AMPTH72–AMPTH",
      "firstAuthor": true,